{
  "version": "1.1.0",
  "name": "Yolo26s320Int8",
  "displayName": "YOLO26s INT8 (320x320)",
  "task": "Object detection",
  "runtime": "ONNX",
  "description": "Runs the Arm-optimized YOLO26s INT8 object detector at 320x320.",
  "ops": [
    {
      "id": "opk-std-ops/InferenceController",
      "attributes": {}
    },
    {
      "id": "opk-std-ops/GenericImagePreprocess",
      "attributes": {
        "inputImageTensorIndex": 0,
        "inputImageSourceName": "pipelineVideoFrame"
      }
    },
    {
      "id": "opk-onnx-ops/Inference",
      "attributes": {
        "modelDescriptor": "model.json",
        "intraOpNumThreads": 2
      }
    },
    {
      "id": "opk-std-ops/GenericPostprocess",
      "attributes": {
        "parser": "YoloParser",
        "outputFormat": "cornerScoreClass",
        "normalizeOutputCoordinates": false,
        "applyNms": false,
        "confidenceThreshold": 0.4
      }
    }
  ]
}

