{
  "version": "1.1.0",
  "name": "NitecResnet18Int8",
  "displayName": "NITEC ResNet-18 INT8",
  "task": "Camera contact",
  "runtime": "ONNX",
  "description": "Detects camera contact from human-face crops.",
  "ops": [
    {"id": "opk-std-ops/InferenceController", "loopId": 1, "attributes": {"contentType": "humanFace"}},
    {"id": "opk-std-ops/GenericImagePreprocess", "loopId": 1, "attributes": {"inputImageTensorIndex": 0, "inputImageSourceName": "pipelineVideoFrame"}},
    {"id": "opk-onnx-ops/Inference", "loopId": 1, "attributes": {"modelDescriptor": "model.json", "intraOpNumThreads": 3}},
    {"id": "opk-std-ops/GenericPostprocess", "loopId": 1, "attributes": {"parser": "CameraContactParser", "contactClassIndex": 1, "noContactClassIndex": 0}}
  ]
}

