{
  "version": "1.0.2",
  "name": "Yolo26nSeg",
  "displayName": "YOLO26n Instance Segmentation (640x640)",
  "task": "Instance segmentation",
  "runtime": "ONNX",
  "description": "Runs YOLO26n instance segmentation at 640x640 on each video frame.",
  "ops": [
    {
      "id": "opk-std-ops/InferenceController",
      "attributes": {}
    },
    {
      "id": "opk-std-ops/GenericImagePreprocess",
      "attributes": {
        "inputImageTensorIndex": 0,
        "inputImageSourceName": "pipelineVideoFrame"
      }
    },
    {
      "id": "opk-onnx-ops/Inference",
      "attributes": {
        "modelDescriptor": "model.json"
      }
    },
    {
      "id": "opk-std-ops/GenericPostprocess",
      "attributes": {
        "parser": "Yolo26InstanceSegmentationParser",
        "confidenceThreshold": 0.25
      }
    }
  ]
}
