{
    "version": "1.0.1",
    "name": "OsnetX025Reid",
    "displayName": "OSNet x0.25",
    "task": "Object re-identification",
    "runtime": "ONNX",
    "description": "Opchain for OsnetX0.25 Re-identification model.",
    "ops": [
        {
            "id": "opk-std-ops/InferenceController",
            "loopId": 1,
            "attributes": {
                "contentType": "genericObject"
            }
        },
        {
            "id": "opk-std-ops/GenericImagePreprocess",
            "loopId": 1,
            "attributes": {
                "inputImageTensorIndex": 0,
                "inputImageSourceName": "pipelineVideoFrame"
            }
        },
        {
            "id": "opk-onnx-ops/Inference",
            "loopId": 1,
            "attributes": {
                "modelDescriptor": "model.json"
            }
        },
        {
            "id": "opk-std-ops/GenericPostprocess",
            "loopId": 1,
            "attributes": {
                "parser": "ObjectEmbeddingParser"
            }
        }
    ]
}
